ID,Name,Description,URL,Last_Updated,Primary_Library,Alt_Names,Unused,Friendly_URL,Subjects,Unused2,More_Info
1,JSTOR,Provides access to a wide range of academic journals and primary source materials across humanities and social sciences.,https://www.jstor.org,2026-02-24,Central Library,Journal Storage,unused,jstor-access,Humanities; Social Sciences; History; Literature,unused,Access via institutional login required
2,ProQuest Dissertations & Theses Global,Comprehensive database of dissertations and theses from universities worldwide.,https://www.proquest.com/pqdtglobal/,2026-02-24,Central Library,ProQuest Theses,unused,proquest-dissertations,Graduate Research; Dissertations,unused,Full-text access to millions of academic works
3,Business Source Complete,Full-text coverage of business-related journals and publications for research and industry analysis.,https://www.ebscohost.com/academic/business-source-complete,2026-02-24,Business Library,Business Premier; Business Complete,unused,business-source,Business; Economics; Management; Marketing,unused,Updated daily with new business content
4,PubMed Central,Free full-text archive of biomedical and life sciences journal literature.,https://www.ncbi.nlm.nih.gov/pmc/,2026-02-24,Medical Library,PMC; NCBI,unused,pubmed-central,Medicine; Biology; Health Sciences; Pharmacology,unused,Resources from NIH and participating publishers
5,Criminal Justice Abstracts,Covers scholarly literature on criminology and criminal justice topics.,https://www.csa.com/,2026-02-24,Law Library,CJA,unused,criminal-justice,Law; Criminology; Criminal Justice; Social Sciences,unused,Coverage of international criminal justice research
